{
  "productCode": "GEN-CANCER-002",
  "regulatoryName": "中意优享恶性肿瘤疾病保险",
  "marketingName": "优享恶性肿瘤疾病保险",
  "productSummery": "恶性肿瘤疾病保险，恶性肿瘤确诊即赔",
  "onlineClaimFlag": true,
  "insurerName": "中意人寿保险有限公司",
  "version": "2024版",
  "salesRegions": "全国（不含港澳台）",
  "effectiveDate": "2024-01-01",
  "expiryDate": null,
  "status": "生效",
  "primaryCategory": "健康保险",
  "primaryCategoryCode": "B",
  "secondaryCategory": "特定疾病保险",
  "secondaryCategoryCode": "B04",
  "racewayId": "B0401",
  "racewayName": "防癌险",
  "salesUrl": "https://www.generalichina.com/products/youxiang",
  "underwritingAge": "出生满28日-70周岁",
  "coveragePeriod": "终身",
  "waitingPeriod": "90天",
  "deductible": "无免赔额",
  "productHeroImage": "https://example.com/images/cancer_hero.jpg",
  "productLongImage": [],
  "productAttachment": [
    "中意优享恶性肿瘤疾病保险-条款.pdf",
    "中意优享恶性肿瘤疾病保险-产品说明书.pdf",
    "中意优享恶性肿瘤疾病保险-费率表.pdf"
  ],
  "clausesCode": ["GEN-CANCER-2024-002"],
  "productIntroduction": "中意优享恶性肿瘤疾病保险是一款恶性肿瘤疾病保险产品，提供恶性肿瘤保障，核保宽松，保费低廉。",
  "productAdvantages": "1. 核保宽松：仅告知癌症相关健康问题\n2. 保费低廉：相比重疾险保费更低\n3. 确诊即赔：恶性肿瘤确诊即赔",
  "precautions": "1. 仅保障恶性肿瘤，不保障其他重疾\n2. 等待期内确诊不承担保险责任",
  "crowd": "仅需恶性肿瘤保障的人群",
  "generalComment": "作为防癌险产品，核保宽松是最大优势。",
  "tags": "核保宽松",
  "coverageArea": "中国大陆（不含港澳台）",
  "hospitalScope": "二级及以上公立医院",
  "claimScope": "经病理学检查确诊后赔付",
  "occupationScope": "不限职业",
  "hesitationPeriod": "15天",
  "policyEffectiveDate": "投保成功次日零时",
  "purchaseLimit": 1,
  "annualPremium": 1000,
  "renewalWarranty": "长期险，无需续保",
  "healthConditionNotice": "健康告知宽松，仅告知癌症相关问题",
  "coverageDetails": [
    {
      "mandatory": true,
      "item_code": "CRITICAL_ILLNESS",
      "item_name": "恶性肿瘤保险金",
      "description": "确诊恶性肿瘤，赔付100%基本保额",
      "details": {
        "illness_count": 1,
        "payout_type": "SINGLE",
        "payout_ratio": 1.0
      }
    },
    {
      "mandatory": true,
      "item_code": "DEATH_OR_TOTAL_DISABILITY",
      "item_name": "身故或全残保险金",
      "description": "身故或全残返还已交保费",
      "details": {
        "payout_logic": "若被保险人身故或全残，返还已交保费"
      }
    }
  ],
  "valueAddedServices": []
}
